{
 "schemaVersion": "boston-gis-stage1a/schema-v0-candidate/0.1.0",
 "adapterVersion": "research/gis-stage1a/normalize.mjs@0.1.0",
 "source": {"sourceFamily":"city-of-boston","dataset":"boston-buildings-with-roof-breaks","featureClass":"BUILDING_PART","licence":"ODC-PDDL-1.0","sourceCrs":"EPSG:6492","sourceLinearUnit":"ftUS","elevationUnit":"ft","transform":"ArcGIS query outSR=4326 -> src/core/Geo.js geo()"},
 "area": {"bboxWgs84":{"s":42.347703,"w":-71.082431,"n":42.351297,"e":-71.077569},"bboxWorld":{"x0":-1380.460107666336,"x1":-980.4960385715406,"z0":454.5195599993639,"z1":854.6036399993252}},
 "coordinates": {"frame":"boston-local","units":"metres","axes":"+X east, -Z north","decimals":2,"projection":"src/core/Geo.js geo() — UNCHANGED"},
 "counts": {"source":218,"normalized":218,"rejected":0},
 "rejected": [],
 "features": [
  {"id":"bos-rb-652070","sourceId":"652070","sourceTimestamp":null,"fact":{"heightFt":43.001,"groundElevFt":7.179,"roofElevFt":50.18,"partUse":"R1","landUse":"R1","braLandUse":"R1","ielType":"BLDG","shapeAreaFt2":949.63},"derived":{"rings":[[[-1362.53,679.2],[-1362.82,678.39],[-1365.01,672.31],[-1365.64,670.56],[-1366.17,669.09],[-1365.81,668.95],[-1359.06,666.74],[-1358.63,666.58],[-1358.44,667.11],[-1357.45,667.19],[-1356.71,669.25],[-1357.22,670.35],[-1357.74,670.54],[-1356.97,672.67],[-1355.33,673.21],[-1354.64,675.13],[-1355.23,676.55]]],"areaM2":88.28,"heightM":13.11,"heightBasis":"BLDG_HGT_2010 x 0.3048"},"confidence":"FACT_IF_PRESENT"},
  {"id":"bos-rb-652071","sourceId":"652071","sourceTimestamp":null,"fact":{"heightFt":40.68,"groundElevFt":9.85,"roofElevFt":50.53,"partUse":"RC","landUse":"RC","braLandUse":"RC","ielType":"BLDG","shapeAreaFt2":1141.74},"derived":{"rings":[[[-1360.66,662.31],[-1365.46,664.15],[-1365.35,664.46],[-1366.79,664.97],[-1366.5,665.66],[-1366.95,665.79],[-1371.21,653.17],[-1371.74,651.68],[-1364.67,649.11],[-1363.85,651.38],[-1363.05,652],[-1362.44,653.69],[-1362.78,655.08],[-1363.27,655.26],[-1362.07,658.61],[-1361.75,658.49],[-1360.62,659.05],[-1359.94,660.95],[-1360.23,662.15]]],"areaM2":106.21,"heightM":12.4,"heightBasis":"BLDG_HGT_2010 x 0.3048"},"confidence":"FACT_IF_PRESENT"},
  {"id":"bos-rb-652072","sourceId":"652072","sourceTimestamp":null,"fact":{"heightFt":65.512,"groundElevFt":9.943,"roofElevFt":75.455,"partUse":"CM","landUse":"RC","braLandUse":"RC","ielType":"BLDG","shapeAreaFt2":2895.74},"derived":{"rings":[[[-1359.37,715.29],[-1367.48,718.2],[-1367.72,717.53],[-1368.44,717.78],[-1368.91,716.46],[-1377.8,690.83],[-1369.19,687.9]]],"areaM2":269.16,"heightM":19.97,"heightBasis":"BLDG_HGT_2010 x 0.3048"},"confidence":"FACT_IF_PRESENT"},
  {"id":"bos-rb-652073","sourceId":"652073","sourceTimestamp":null,"fact":{"heightFt":41.255,"groundElevFt":8.825,"roofElevFt":50.08,"partUse":"RC","landUse":"RC","braLandUse":"RC","ielType":"BLDG","shapeAreaFt2":1003.78},"derived":{"rings":[[[-1366.95,665.79],[-1368.53,666.36],[-1369.5,668.06],[-1371.34,668.73],[-1373,667.98],[-1377.44,655.02],[-1376.77,654.25],[-1374.7,653.5],[-1373.43,653.97],[-1372.48,653.63],[-1371.21,653.17]]],"areaM2":93.29,"heightM":12.57,"heightBasis":"BLDG_HGT_2010 x 0.3048"},"confidence":"FACT_IF_PRESENT"},
  {"id":"bos-rb-652074","sourceId":"652074","sourceTimestamp":null,"fact":{"heightFt":40.924,"groundElevFt":9.201,"roofElevFt":50.125,"partUse":"RC","landUse":"RC","braLandUse":"RC","ielType":"BLDG","shapeAreaFt2":1032.39},"derived":{"rings":[[[-1373,667.98],[-1375.11,668.75],[-1375.65,670.25],[-1378.27,671.2],[-1378.56,671.31],[-1383.59,657.52],[-1383.13,656.15],[-1381.37,655.51],[-1379.93,655.92],[-1379.44,655.74],[-1378.08,655.25],[-1377.44,655.02]]],"areaM2":95.94,"heightM":12.47,"heightBasis":"BLDG_HGT_2010 x 0.3048"},"confidence":"FACT_IF_PRESENT"},
  {"id":"bos-rb-652075","sourceId":"652075","sourceTimestamp":null,"fact":{"heightFt":52.48,"groundElevFt":9.92,"roofElevFt":62.4,"partUse":"C","landUse":"C","braLandUse":"C","ielType":"BLDG","shapeAreaFt2":4949.76},"derived":{"rings":[[[-1368.91,716.46],[-1384.16,721.91],[-1383.67,723.28],[-1384.2,723.47],[-1393.36,697.72],[-1393.86,696.32],[-1377.8,690.83]]],"areaM2":460.23,"heightM":16,"heightBasis":"BLDG_HGT_2010 x 0.3048"},"confidence":"FACT_IF_PRESENT"},
  {"id":"bos-rb-652076","sourceId":"652076","sourceTimestamp":null,"fact":{"heightFt":51.411,"groundElevFt":9.759,"roofElevFt":61.17,"partUse":"RC","landUse":"RC","braLandUse":"RC","ielType":"BLDG","shapeAreaFt2":1118.81},"derived":{"rings":[[[-1378.56,671.31],[-1377.93,673.06],[-1379.51,673.63],[-1380.07,674.79],[-1382.07,675.51],[-1383.4,674.89],[-1389.33,659.61],[-1389.04,659.05],[-1388.58,658.19],[-1388.49,658.16],[-1386.94,657.59],[-1386.82,657.65],[-1385.63,658.27],[-1385.55,658.24],[-1384.17,657.74],[-1383.59,657.52]]],"areaM2":103.96,"heightM":15.67,"heightBasis":"BLDG_HGT_2010 x 0.3048"},"confidence":"FACT_IF_PRESENT"},
  {"id":"bos-rb-652513","sourceId":"652513","sourceTimestamp":null,"fact":{"heightFt":50.731,"groundElevFt":7.609,"roofElevFt":58.34,"partUse":"RC","landUse":"RC","braLandUse":"RC","ielType":"BLDG","shapeAreaFt2":1358.21},"derived":{"rings":[[[-1327.05,604.09],[-1325.55,608.35],[-1325.65,608.38],[-1328.01,609.22],[-1328.12,609.26],[-1329.14,609.62],[-1329.17,609.63],[-1330.53,610.11],[-1330.61,610.14],[-1331.63,610.51],[-1331.94,610.61],[-1333.44,606.34],[-1338.02,593.89],[-1337.27,592.67],[-1335.03,591.71],[-1333.68,592.35],[-1331.31,591.51]]],"areaM2":126.28,"heightM":15.46,"heightBasis":"BLDG_HGT_2010 x 0.3048"},"confidence":"FACT_IF_PRESENT"},
  {"id":"bos-rb-652514","sourceId":"652514","sourceTimestamp":null,"fact":{"heightFt":41.899,"groundElevFt":8.051,"roofElevFt":49.95,"partUse":"RC","landUse":"RC","braLandUse":"RC","ielType":"BLDG","shapeAreaFt2":1103.69},"derived":{"rings":[[[-1333.44,606.34],[-1333.69,606.43],[-1335.6,607.1],[-1335.66,607.12],[-1336.37,608.54],[-1336.96,608.75],[-1338.14,609.17],[-1338.3,609.23],[-1339.87,608.59],[-1339.49,609.69],[-1339.69,609.76],[-1339.93,609.85],[-1342.49,602.57],[-1344.65,596.45],[-1344.13,595.66],[-1343.62,594.87],[-1341.51,594.12],[-1340.37,594.72],[-1338.02,593.89]]],"areaM2":102.6,"heightM":12.77,"heightBasis":"BLDG_HGT_2010 x 0.3048"},"confidence":"FACT_IF_PRESENT"},
  {"id":"bos-rb-652515","sourceId":"652515","sourceTimestamp":null,"fact":{"heightFt":50.486,"groundElevFt":7.074,"roofElevFt":57.56,"partUse":"RC","landUse":"RC","braLandUse":"RC","ielType":"BLDG","shapeAreaFt2":1388.73},"derived":{"rings":[[[-1339.93,609.85],[-1340.6,610.08],[-1340.81,610.16],[-1341.15,610.28],[-1344.21,611.37],[-1344.6,610.25],[-1345.11,610.43],[-1345.62,611.89],[-1348.24,612.82],[-1349.3,611.91],[-1349.47,611.97],[-1352.37,613],[-1353.52,613.41],[-1353.08,614.67],[-1354.77,615.27],[-1355.3,615.45],[-1356.07,615.73],[-1356.04,615.81],[-1356.37,615.93],[-1356.84,614.59],[-1356.97,614.2],[-1357.1,614.25],[-1357.76,613.3],[-1358.4,611.49],[-1357.98,610.31],[-1357.65,610.19],[-1357.79,609.79],[-1358.03,609.87],[-1358.59,608.28],[-1358.42,608.22],[-1342.49,602.57]]],"areaM2":129.07,"heightM":15.39,"heightBasis":"BLDG_HGT_2010 x 0.3048"},"confidence":"FACT_IF_PRESENT"},
  {"id":"bos-rb-652516","sourceId":"652516","sourceTimestamp":null,"fact":{"heightFt":52.684,"groundElevFt":7.216,"roofElevFt":59.9,"partUse":"C","landUse":"C","braLandUse":"C","ielType":"BLDG","shapeAreaFt2":1635.34},"derived":{"rings":[[[-1249.6,558.79],[-1246.36,567.99],[-1247.22,568.29],[-1245.09,574.34],[-1245.8,575.7],[-1246.41,575.92],[-1248.06,576.5],[-1248.36,576.61],[-1249.56,575.94],[-1249.6,575.81],[-1250.4,576.1],[-1252.32,576.78],[-1253.01,577.02],[-1258.15,562.4],[-1258.39,561.72],[-1254.35,560.29],[-1254.5,559.15],[-1251.64,558.29],[-1251.26,559.38]]],"areaM2":152.02,"heightM":16.06,"heightBasis":"BLDG_HGT_2010 x 0.3048"},"confidence":"FACT_IF_PRESENT"},
  {"id":"bos-rb-652517","sourceId":"652517","sourceTimestamp":null,"fact":{"heightFt":52.01,"groundElevFt":7.515,"roofElevFt":59.525,"partUse":"C","landUse":"C","braLandUse":"C","ielType":"BLDG","shapeAreaFt2":1382.22},"derived":{"rings":[[[-1258.15,562.4],[-1253.01,577.02],[-1253.23,577.1],[-1253.18,577.24],[-1253.64,578.44],[-1254.43,578.72],[-1255.37,579.05],[-1255.76,579.19],[-1257.24,578.66],[-1257.32,578.43],[-1257.64,578.54],[-1259.84,579.32],[-1260.14,579.43],[-1265.25,564.92],[-1262.31,563.88],[-1261.95,562.58],[-1262.41,561.27],[-1259.41,560.21],[-1258.59,562.56]]],"areaM2":128.5,"heightM":15.85,"heightBasis":"BLDG_HGT_2010 x 0.3048"},"confidence":"FACT_IF_PRESENT"},
  {"id":"bos-rb-652518","sourceId":"652518","sourceTimestamp":null,"fact":{"heightFt":50.611,"groundElevFt":9.009,"roofElevFt":59.62,"partUse":"RC","landUse":"RC","braLandUse":"RC","ielType":"BLDG","shapeAreaFt2":1350.23},"derived":{"rings":[[[-1265.25,564.92],[-1260.14,579.43],[-1260.43,579.53],[-1260.65,580.92],[-1262.97,581.75],[-1264.19,581.1],[-1264.26,580.92],[-1264.62,581.05],[-1266.59,581.75],[-1267.04,581.91],[-1272.16,567.37],[-1272.79,565.59],[-1270.16,564.65],[-1269.53,566.44],[-1269.28,566.35],[-1269.43,565.91],[-1268.92,565.29],[-1266.62,564.48],[-1265.34,564.66]]],"areaM2":125.56,"heightM":15.43,"heightBasis":"BLDG_HGT_2010 x 0.3048"},"confidence":"FACT_IF_PRESENT"},